[
  {
    "nsl_id": "001",
    "name": "Palmyra Ancient City",
    "category": "Cultural Heritage Sites",
    "mgrs": "37SDU 32902 23443",
    "lat": 34.550533,
    "lon": 38.268667,
    "effective_dtg": "2013-03-09T00:00:00Z",
    "expiration_dtg": "UFN",
    "reason_authority": "UN",
    "approval_authority": "CJTF",
    "remarks": "UNESCO World Heritage Site; protected cultural heritage site in Tadmur (Palmyra), Syria. Coordinates reference the archaeological core."
  }
]

